"NAICS_Code","Industry","Emission_With_Margins","Diff_From_Avg","Emission_Rank"
423730,Warm Air Heating and Air-Conditioning Equipment and Supplies Merchant Wholesalers,0.1469999998807907,-0.239,240
423740,Refrigeration Equipment and Supplies Merchant Wholesalers,0.1469999998807907,-0.239,240
423910,Sporting and Recreational Goods and Supplies Merchant Wholesalers,0.1469999998807907,-0.239,240
423920,Toy and Hobby Goods and Supplies Merchant Wholesalers,0.1469999998807907,-0.239,240
423930,Recyclable Material Merchant Wholesalers,0.1469999998807907,-0.239,240
423940,"Jewelry, Watch, Precious Stone, and Precious Metal Merchant Wholesalers",0.1469999998807907,-0.239,240
423990,Other Miscellaneous Durable Goods Merchant Wholesalers,0.1469999998807907,-0.239,240
336415,Guided Missile and Space Vehicle Propulsion Unit and Propulsion Unit Parts Manufacturing,0.1459999978542328,-0.24,241
336419,Other Guided Missile and Space Vehicle Parts and Auxiliary Equipment Manufacturing,0.1459999978542328,-0.24,241
515210,Cable and Other Subscription Programming,0.1459999978542328,-0.24,241
624110,Child and Youth Services,0.14499999582767487,-0.241,242
624120,Services for the Elderly and Persons with Disabilities,0.14499999582767487,-0.241,242
624190,Other Individual and Family Services,0.14499999582767487,-0.241,242
315110,Hosiery and Sock Mills,0.14499999582767487,-0.241,242
315190,Other Apparel Knitting Mills,0.14499999582767487,-0.241,242
315210,Cut and Sew Apparel Contractors,0.14499999582767487,-0.241,242
315220,Men's and Boys' Cut and Sew Apparel Manufacturing,0.14499999582767487,-0.241,242
315240,"Women's, Girls', and Infants' Cut and Sew Apparel Manufacturing",0.14499999582767487,-0.241,242
315280,Other Cut and Sew Apparel Manufacturing,0.14499999582767487,-0.241,242
315990,Apparel Accessories and Other Apparel Manufacturing,0.14499999582767487,-0.241,242
325413,In-Vitro Diagnostic Substance Manufacturing,0.14300000667572021,-0.243,243
532111,Passenger Car Rental,0.14300000667572021,-0.243,243
532112,Passenger Car Leasing,0.14300000667572021,-0.243,243
532120,"Truck, Utility Trailer, and RV (Recreational Vehicle) Rental and Leasing",0.14300000667572021,-0.243,243
334510,Electromedical and Electrotherapeutic Apparatus Manufacturing,0.1420000046491623,-0.244,244
532411,"Commercial Air, Rail, and Water Transportation Equipment Rental and Leasing",0.14000000059604645,-0.246,245
532412,"Construction, Mining, and Forestry Machinery and Equipment Rental and Leasing",0.14000000059604645,-0.246,245
532420,Office Machinery and Equipment Rental and Leasing,0.14000000059604645,-0.246,245
532490,Other Commercial and Industrial Machinery and Equipment Rental and Leasing,0.14000000059604645,-0.246,245
811310,Commercial and Industrial Machinery and Equipment (except Automotive and Electronic) Repair and Maintenance,0.14000000059604645,-0.246,245
541940,Veterinary Services,0.13899999856948853,-0.247,246
713110,Amusement and Theme Parks,0.1379999965429306,-0.248,247
713120,Amusement Arcades,0.1379999965429306,-0.248,247
339115,Ophthalmic Goods Manufacturing,0.1379999965429306,-0.248,247
334512,"Automatic Environmental Control Manufacturing for Residential, Commercial, and Appliance Use",0.13699999451637268,-0.249,248
611110,Elementary and Secondary Schools,0.13699999451637268,-0.249,248
511120,Periodical Publishers,0.13600000739097595,-0.25,249
813410,Civic and Social Organizations,0.13600000739097595,-0.25,249
813910,Business Associations,0.13600000739097595,-0.25,249
813920,Professional Organizations,0.13600000739097595,-0.25,249
813930,Labor Unions and Similar Labor Organizations,0.13600000739097595,-0.25,249
813940,Political Organizations,0.13600000739097595,-0.25,249
813990,"Other Similar Organizations (except Business, Professional, Labor, and Political Organizations)",0.13600000739097595,-0.25,249
334112,Computer Storage Device Manufacturing,0.13600000739097595,-0.25,249
334613,Blank Magnetic and Optical Recording Media Manufacturing,0.1340000033378601,-0.252,250
334614,"Software and Other Prerecorded Compact Disc, Tape, and Record Reproducing",0.1340000033378601,-0.252,250
532210,Consumer Electronics and Appliances Rental,0.1340000033378601,-0.252,250
532281,Formal Wear and Costume Rental,0.1340000033378601,-0.252,250
532282,Video Tape and Disc Rental,0.1340000033378601,-0.252,250
532283,Home Health Equipment Rental,0.1340000033378601,-0.252,250
532284,Recreational Goods Rental,0.1340000033378601,-0.252,250
532289,All Other Consumer Goods Rental,0.1340000033378601,-0.252,250
532310,General Rental Centers,0.1340000033378601,-0.252,250
511110,Newspaper Publishers,0.13099999725818634,-0.255,251
424210,Drugs and Druggists' Sundries Merchant Wholesalers,0.13099999725818634,-0.255,251
551111,Offices of Bank Holding Companies,0.12999999523162842,-0.256,252
551112,Offices of Other Holding Companies,0.12999999523162842,-0.256,252
551114,"Corporate, Subsidiary, and Regional Managing Offices",0.12999999523162842,-0.256,252
541810,Advertising Agencies,0.1289999932050705,-0.257,253
541820,Public Relations Agencies,0.1289999932050705,-0.257,253
541830,Media Buying Agencies,0.1289999932050705,-0.257,253
541840,Media Representatives,0.1289999932050705,-0.257,253
541850,Outdoor Advertising,0.1289999932050705,-0.257,253
541860,Direct Mail Advertising,0.1289999932050705,-0.257,253
541870,Advertising Material Distribution Services,0.1289999932050705,-0.257,253
541890,Other Services Related to Advertising,0.1289999932050705,-0.257,253
519130,Internet Publishing and Broadcasting and Web Search Portals,0.12800000607967377,-0.258,254
621511,Medical Laboratories,0.12700000405311584,-0.259,255
621512,Diagnostic Imaging Centers,0.12700000405311584,-0.259,255
811111,General Automotive Repair,0.12700000405311584,-0.259,255
811112,Automotive Exhaust System Repair,0.12700000405311584,-0.259,255
811113,Automotive Transmission Repair,0.12700000405311584,-0.259,255
811118,Other Automotive Mechanical and Electrical Repair and Maintenance,0.12700000405311584,-0.259,255
811121,"Automotive Body, Paint, and Interior Repair and Maintenance",0.12700000405311584,-0.259,255
811122,Automotive Glass Replacement Shops,0.12700000405311584,-0.259,255
811191,Automotive Oil Change and Lubrication Shops,0.12700000405311584,-0.259,255
811192,Car Washes,0.12700000405311584,-0.259,255
811198,All Other Automotive Repair and Maintenance,0.12700000405311584,-0.259,255
541310,Architectural Services,0.125,-0.261,256
541320,Landscape Architectural Services,0.125,-0.261,256
541330,Engineering Services,0.125,-0.261,256
541340,Drafting Services,0.125,-0.261,256
541350,Building Inspection Services,0.125,-0.261,256
541360,Geophysical Surveying and Mapping Services,0.125,-0.261,256
541370,Surveying and Mapping (except Geophysical) Services,0.125,-0.261,256
541380,Testing Laboratories,0.125,-0.261,256
511130,Book Publishers,0.125,-0.261,256
517410,Satellite Telecommunications,0.125,-0.261,256
517911,Telecommunications Resellers,0.125,-0.261,256
517919,All Other Telecommunications,0.125,-0.261,256
611410,Business and Secretarial Schools,0.125,-0.261,256
611420,Computer Training,0.125,-0.261,256
611430,Professional and Management Development Training,0.125,-0.261,256
611511,Cosmetology and Barber Schools,0.125,-0.261,256
611512,Flight Training,0.125,-0.261,256
611513,Apprenticeship Training,0.125,-0.261,256
611519,Other Technical and Trade Schools,0.125,-0.261,256
611610,Fine Arts Schools,0.125,-0.261,256
611620,Sports and Recreation Instruction,0.125,-0.261,256
611630,Language Schools,0.125,-0.261,256
611691,Exam Preparation and Tutoring,0.125,-0.261,256
611692,Automobile Driving Schools,0.125,-0.261,256
611699,All Other Miscellaneous Schools and Instruction,0.125,-0.261,256
611710,Educational Support Services,0.125,-0.261,256
334310,Audio and Video Equipment Manufacturing,0.12399999797344208,-0.262,257
541921,"Photography Studios, Portrait",0.12200000137090683,-0.264,258
541922,Commercial Photography,0.12200000137090683,-0.264,258
561910,Packaging and Labeling Services,0.12099999934434891,-0.265,259
561920,Convention and Trade Show Organizers,0.12099999934434891,-0.265,259
561990,All Other Support Services,0.12099999934434891,-0.265,259
621310,Offices of Chiropractors,0.11999999731779099,-0.266,260
621320,Offices of Optometrists,0.11999999731779099,-0.266,260
621330,Offices of Mental Health Practitioners (except Physicians),0.11999999731779099,-0.266,260
621340,"Offices of Physical, Occupational and Speech Therapists, and Audiologists",0.11999999731779099,-0.266,260
621391,Offices of Podiatrists,0.11999999731779099,-0.266,260
621399,Offices of All Other Miscellaneous Health Practitioners,0.11999999731779099,-0.266,260
561410,Document Preparation Services,0.11800000071525574,-0.268,261
561421,Telephone Answering Services,0.11800000071525574,-0.268,261
561422,Telemarketing Bureaus and Other Contact Centers,0.11800000071525574,-0.268,261
561431,Private Mail Centers,0.11800000071525574,-0.268,261
561439,Other Business Service Centers (including Copy Shops),0.11800000071525574,-0.268,261
561440,Collection Agencies,0.11800000071525574,-0.268,261
561450,Credit Bureaus,0.11800000071525574,-0.268,261
561491,Repossession Services,0.11800000071525574,-0.268,261
561492,Court Reporting and Stenotype Services,0.11800000071525574,-0.268,261
561499,All Other Business Support Services,0.11800000071525574,-0.268,261
312230,Tobacco Manufacturing,0.11800000071525574,-0.268,261
423810,Construction and Mining (except Oil Well) Machinery and Equipment Merchant Wholesalers,0.11699999868869781,-0.269,262
423820,Farm and Garden Machinery and Equipment Merchant Wholesalers,0.11699999868869781,-0.269,262
423830,Industrial Machinery and Equipment Merchant Wholesalers,0.11699999868869781,-0.269,262
423840,Industrial Supplies Merchant Wholesalers,0.11699999868869781,-0.269,262
423850,Service Establishment Equipment and Supplies Merchant Wholesalers,0.11699999868869781,-0.269,262
423860,Transportation Equipment and Supplies (except Motor Vehicle) Merchant Wholesalers,0.11699999868869781,-0.269,262
334515,Instrument Manufacturing for Measuring and Testing Electricity and Electrical Signals,0.11599999666213989,-0.27,263
236116,New Multifamily Housing Construction (except For-Sale Builders),0.11599999666213989,-0.27,263
621410,Family Planning Centers,0.11599999666213989,-0.27,263
621420,Outpatient Mental Health and Substance Abuse Centers,0.11599999666213989,-0.27,263
621491,HMO Medical Centers,0.11599999666213989,-0.27,263
621492,Kidney Dialysis Centers,0.11599999666213989,-0.27,263
621493,Freestanding Ambulatory Surgical and Emergency Centers,0.11599999666213989,-0.27,263
621498,All Other Outpatient Care Centers,0.11599999666213989,-0.27,263
334513,"Instruments and Related Products Manufacturing for Measuring, Displaying, and Controlling Industrial Process Variables",0.11500000208616257,-0.271,264
334290,Other Communications Equipment Manufacturing,0.11400000005960464,-0.272,265
336412,Aircraft Engine and Engine Parts Manufacturing,0.11400000005960464,-0.272,265
334111,Electronic Computer Manufacturing,0.1120000034570694,-0.274,266
621610,Home Health Care Services,0.1120000034570694,-0.274,266
515111,Radio Networks,0.10999999940395355,-0.276,267
515112,Radio Stations,0.10999999940395355,-0.276,267
515120,Television Broadcasting,0.10999999940395355,-0.276,267
812111,Barber Shops,0.10899999737739563,-0.277,268
812112,Beauty Salons,0.10899999737739563,-0.277,268
812113,Nail Salons,0.10899999737739563,-0.277,268
812191,Diet and Weight Reducing Centers,0.10899999737739563,-0.277,268
812199,Other Personal Care Services,0.10899999737739563,-0.277,268
423610,"Electrical Apparatus and Equipment, Wiring Supplies, and Related Equipment Merchant Wholesalers",0.10899999737739563,-0.277,268
423620,"Household Appliances, Electric Housewares, and Consumer Electronics Merchant Wholesalers",0.10899999737739563,-0.277,268
423690,Other Electronic Parts and Equipment Merchant Wholesalers,0.10899999737739563,-0.277,268
325412,Pharmaceutical Preparation Manufacturing,0.10700000077486038,-0.279,269
519190,All Other Information Services,0.10700000077486038,-0.279,269
519110,News Syndicates,0.10700000077486038,-0.279,269
519120,Libraries and Archives,0.10700000077486038,-0.279,269
561110,Office Administrative Services,0.10499999672174454,-0.281,270
339116,Dental Laboratories,0.10400000214576721,-0.282,271
441110,New Car Dealers,0.10400000214576721,-0.282,271
441120,Used Car Dealers,0.10400000214576721,-0.282,271
441210,Recreational Vehicle Dealers,0.10400000214576721,-0.282,271
441222,Boat Dealers,0.10400000214576721,-0.282,271
441228,"Motorcycle, ATV, and All Other Motor Vehicle Dealers",0.10400000214576721,-0.282,271
441310,Automotive Parts and Accessories Stores,0.10400000214576721,-0.282,271
441320,Tire Dealers,0.10400000214576721,-0.282,271
561510,Travel Agencies,0.10300000011920929,-0.283,272
561520,Tour Operators,0.10300000011920929,-0.283,272
561591,Convention and Visitors Bureaus,0.10300000011920929,-0.283,272
561599,All Other Travel Arrangement and Reservation Services,0.10300000011920929,-0.283,272
444110,Home Centers,0.10100000351667404,-0.285,273
444120,Paint and Wallpaper Stores,0.10100000351667404,-0.285,273
444130,Hardware Stores,0.10100000351667404,-0.285,273
444190,Other Building Material Dealers,0.10100000351667404,-0.285,273
444210,Outdoor Power Equipment Stores,0.10100000351667404,-0.285,273
444220,"Nursery, Garden Center, and Farm Supply Stores",0.10100000351667404,-0.285,273
334519,Other Measuring and Controlling Device Manufacturing,0.10000000149011612,-0.286,274
812910,Pet Care (except Veterinary) Services,0.0989999994635582,-0.287,275
812921,Photofinishing Laboratories (except One-Hour),0.0989999994635582,-0.287,275
812922,One-Hour Photofinishing,0.0989999994635582,-0.287,275
812930,Parking Lots and Garages,0.0989999994635582,-0.287,275
812990,All Other Personal Services,0.0989999994635582,-0.287,275
541511,Custom Computer Programming Services,0.09700000286102295,-0.289,276
511210,Software Publishers,0.09700000286102295,-0.289,276
334516,Analytical Laboratory Instrument Manufacturing,0.09300000220537186,-0.293,277
454110,Electronic Shopping and Mail-Order Houses,0.09099999815225601,-0.295,278
454210,Vending Machine Operators,0.09099999815225601,-0.295,278
454310,Fuel Dealers,0.09099999815225601,-0.295,278
454390,Other Direct Selling Establishments,0.09099999815225601,-0.295,278
621210,Offices of Dentists,0.09000000357627869,-0.296,279
811211,Consumer Electronics Repair and Maintenance,0.09000000357627869,-0.296,279
811212,Computer and Office Machine Repair and Maintenance,0.09000000357627869,-0.296,279
811213,Communication Equipment Repair and Maintenance,0.09000000357627869,-0.296,279
811219,Other Electronic and Precision Equipment Repair and Maintenance,0.09000000357627869,-0.296,279
541410,Interior Design Services,0.08799999952316284,-0.298,280
541420,Industrial Design Services,0.08799999952316284,-0.298,280
541430,Graphic Design Services,0.08799999952316284,-0.298,280
541490,Other Specialized Design Services,0.08799999952316284,-0.298,280
541513,Computer Facilities Management Services,0.08699999749660492,-0.299,281
541519,Other Computer Related Services,0.08699999749660492,-0.299,281
621111,Offices of Physicians (except Mental Health Specialists),0.0860000029206276,-0.3,282
621112,"Offices of Physicians, Mental Health Specialists",0.0860000029206276,-0.3,282
811411,Home and Garden Equipment Repair and Maintenance,0.0860000029206276,-0.3,282
811412,Appliance Repair and Maintenance,0.0860000029206276,-0.3,282
811420,Reupholstery and Furniture Repair,0.0860000029206276,-0.3,282
811430,Footwear and Leather Goods Repair,0.0860000029206276,-0.3,282
811490,Other Personal and Household Goods Repair and Maintenance,0.0860000029206276,-0.3,282
423410,Photographic Equipment and Supplies Merchant Wholesalers,0.08500000089406967,-0.301,283
423420,Office Equipment Merchant Wholesalers,0.08500000089406967,-0.301,283
423430,Computer and Computer Peripheral Equipment and Software Merchant Wholesalers,0.08500000089406967,-0.301,283
423440,Other Commercial Equipment Merchant Wholesalers,0.08500000089406967,-0.301,283
423450,"Medical, Dental, and Hospital Equipment and Supplies Merchant Wholesalers",0.08500000089406967,-0.301,283
423460,Ophthalmic Goods Merchant Wholesalers,0.08500000089406967,-0.301,283
423490,Other Professional Equipment and Supplies Merchant Wholesalers,0.08500000089406967,-0.301,283
325414,Biological Product (except Diagnostic) Manufacturing,0.08500000089406967,-0.301,283
711110,Theater Companies and Dinner Theaters,0.08399999886751175,-0.302,284
711120,Dance Companies,0.08399999886751175,-0.302,284
711130,Musical Groups and Artists,0.08399999886751175,-0.302,284
711190,Other Performing Arts Companies,0.08399999886751175,-0.302,284
541611,Administrative Management and General Management Consulting Services,0.08399999886751175,-0.302,284
541612,Human Resources Consulting Services,0.08399999886751175,-0.302,284
541613,Marketing Consulting Services,0.08399999886751175,-0.302,284
541614,"Process, Physical Distribution, and Logistics Consulting Services",0.08399999886751175,-0.302,284
541618,Other Management Consulting Services,0.08399999886751175,-0.302,284
711310,"Promoters of Performing Arts, Sports, and Similar Events with Facilities",0.08299999684095383,-0.303,285
711320,"Promoters of Performing Arts, Sports, and Similar Events without Facilities",0.08299999684095383,-0.303,285
711410,"Agents and Managers for Artists, Athletes, Entertainers, and Other Public Figures",0.08299999684095383,-0.303,285
517311,Wired Telecommunications Carriers,0.0820000022649765,-0.304,286
561611,Investigation Services,0.07999999821186066,-0.306,287
561612,Security Guards and Patrol Services,0.07999999821186066,-0.306,287
561613,Armored Car Services,0.07999999821186066,-0.306,287
561621,Security Systems Services (except Locksmiths),0.07999999821186066,-0.306,287
561622,Locksmiths,0.07999999821186066,-0.306,287
541620,Environmental Consulting Services,0.07900000363588333,-0.307,288
541690,Other Scientific and Technical Consulting Services,0.07900000363588333,-0.307,288
424710,Petroleum Bulk Stations and Terminals,0.07800000160932541,-0.308,289
424720,Petroleum and Petroleum Products Merchant Wholesalers (except Bulk Stations and Terminals),0.07800000160932541,-0.308,289
541512,Computer Systems Design Services,0.07699999958276749,-0.309,290
541930,Translation and Interpretation Services,0.07500000298023224,-0.311,291
541990,"All Other Professional, Scientific, and Technical Services",0.07500000298023224,-0.311,291
541910,Marketing Research and Public Opinion Polling,0.07500000298023224,-0.311,291
711211,Sports Teams and Clubs,0.07199999690055847,-0.314,292
711212,Racetracks,0.07199999690055847,-0.314,292
711219,Other Spectator Sports,0.07199999690055847,-0.314,292
334514,Totalizing Fluid Meter and Counting Device Manufacturing,0.07199999690055847,-0.314,292
512110,Motion Picture and Video Production,0.07100000232458115,-0.315,293
512120,Motion Picture and Video Distribution,0.07100000232458115,-0.315,293
512131,Motion Picture Theaters (except Drive-Ins),0.07100000232458115,-0.315,293
512132,Drive-In Motion Picture Theaters,0.07100000232458115,-0.315,293
512191,Teleproduction and Other Postproduction Services,0.07100000232458115,-0.315,293
512199,Other Motion Picture and Video Industries,0.07100000232458115,-0.315,293
512230,Music Publishers,0.06800000369548798,-0.318,294
512240,Sound Recording Studios,0.06800000369548798,-0.318,294
512250,Record Production and Distribution,0.06800000369548798,-0.318,294
512290,Other Sound Recording Industries,0.06800000369548798,-0.318,294
813211,Grantmaking Foundations,0.06499999761581421,-0.321,295
813212,Voluntary Health Organizations,0.06499999761581421,-0.321,295
813219,Other Grantmaking and Giving Services,0.06499999761581421,-0.321,295
813311,Human Rights Organizations,0.06499999761581421,-0.321,295
813312,"Environment, Conservation and Wildlife Organizations",0.06499999761581421,-0.321,295
813319,Other Social Advocacy Organizations,0.06499999761581421,-0.321,295
522210,Credit Card Issuing,0.06400000303983688,-0.322,296
522220,Sales Financing,0.06400000303983688,-0.322,296
522291,Consumer Lending,0.06400000303983688,-0.322,296
522292,Real Estate Credit,0.06400000303983688,-0.322,296
522293,International Trade Financing,0.06400000303983688,-0.322,296
522294,Secondary Market Financing,0.06400000303983688,-0.322,296
522298,All Other Nondepository Credit Intermediation,0.06400000303983688,-0.322,296
522310,Mortgage and Nonmortgage Loan Brokers,0.06400000303983688,-0.322,296
522320,"Financial Transactions Processing, Reserve, and Clearinghouse Activities",0.06400000303983688,-0.322,296
522390,Other Activities Related to Credit Intermediation,0.06400000303983688,-0.322,296
523910,Miscellaneous Intermediation,0.06199999898672104,-0.324,297
523920,Portfolio Management,0.06199999898672104,-0.324,297
523930,Investment Advice,0.06199999898672104,-0.324,297
523991,"Trust, Fiduciary, and Custody Activities",0.06199999898672104,-0.324,297
523999,Miscellaneous Financial Investment Activities,0.06199999898672104,-0.324,297
523110,Investment Banking and Securities Dealing,0.05999999865889549,-0.326,298
523120,Securities Brokerage,0.05999999865889549,-0.326,298
523130,Commodity Contracts Dealing,0.05999999865889549,-0.326,298
523140,Commodity Contracts Brokerage,0.05999999865889549,-0.326,298
523210,Securities and Commodity Exchanges,0.05999999865889549,-0.326,298
334511,"Search, Detection, Navigation, Guidance, Aeronautical, and Nautical System and Instrument Manufacturing",0.05999999865889549,-0.326,298
533110,Lessors of Nonfinancial Intangible Assets (except Copyrighted Works),0.057999998331069946,-0.328,299
541110,Offices of Lawyers,0.05400000140070915,-0.332,300
541120,Offices of Notaries,0.05400000140070915,-0.332,300
541191,Title Abstract and Settlement Offices,0.05400000140070915,-0.332,300
541199,All Other Legal Services,0.05400000140070915,-0.332,300
425110,Business to Business Electronic Markets,0.050999999046325684,-0.335,301
425120,Wholesale Trade Agents and Brokers,0.050999999046325684,-0.335,301
541211,Offices of Certified Public Accountants,0.05000000074505806,-0.336,302
541213,Tax Preparation Services,0.05000000074505806,-0.336,302
541214,Payroll Services,0.05000000074505806,-0.336,302
541219,Other Accounting Services,0.05000000074505806,-0.336,302
521110,Monetary Authorities-Central Bank,0.04800000041723251,-0.338,303
522110,Commercial Banking,0.04800000041723251,-0.338,303
522120,Savings Institutions,0.04800000041723251,-0.338,303
522130,Credit Unions,0.04800000041723251,-0.338,303
522190,Other Depository Credit Intermediation,0.04800000041723251,-0.338,303
524114,Direct Health and Medical Insurance Carriers,0.03400000184774399,-0.352,304
524126,Direct Property and Casualty Insurance Carriers,0.03400000184774399,-0.352,304
524127,Direct Title Insurance Carriers,0.03400000184774399,-0.352,304
524128,"Other Direct Insurance (except Life, Health, and Medical) Carriers",0.03400000184774399,-0.352,304
524130,Reinsurance Carriers,0.03400000184774399,-0.352,304
524210,Insurance Agencies and Brokerages,0.03400000184774399,-0.352,304
524291,Claims Adjusting,0.03400000184774399,-0.352,304
524292,Third Party Administration of Insurance and Pension Funds,0.03400000184774399,-0.352,304
524298,All Other Insurance Related Activities,0.03400000184774399,-0.352,304
812210,Funeral Homes and Funeral Services,0.03400000184774399,-0.352,304
812220,Cemeteries and Crematories,0.03400000184774399,-0.352,304
561311,Employment Placement Agencies,0.032999999821186066,-0.353,305
561312,Executive Search Services,0.032999999821186066,-0.353,305
561320,Temporary Help Services,0.032999999821186066,-0.353,305
561330,Professional Employer Organizations,0.032999999821186066,-0.353,305
524113,Direct Life Insurance Carriers,0.029999999329447746,-0.356,306
531110,Lessors of Residential Buildings and Dwellings,0.01899999938905239,-0.367,307
711510,"Independent Artists, Writers, and Performers",0.013000000268220901,-0.373,308
